{
  "$schema": "https://json-schema.org/draft/2020-12/schema",
  "$id": "devkit/codex-plugin",
  "x-provenance": "best-effort",
  "type": "object",
  "additionalProperties": false,
  "required": [
    "_generated",
    "name",
    "version",
    "description",
    "author",
    "homepage",
    "repository",
    "license",
    "keywords",
    "skills",
    "hooks",
    "interface"
  ],
  "$defs": {
    "author": {
      "type": "object",
      "additionalProperties": false,
      "required": ["name", "email"],
      "properties": {
        "name": { "type": "string", "minLength": 1 },
        "email": { "type": "string", "format": "email" }
      }
    },
    "interface": {
      "type": "object",
      "additionalProperties": false,
      "required": [
        "displayName",
        "shortDescription",
        "longDescription",
        "developerName",
        "category",
        "capabilities",
        "websiteURL",
        "brandColor",
        "composerIcon",
        "logo"
      ],
      "properties": {
        "displayName": { "type": "string", "minLength": 1 },
        "shortDescription": { "type": "string", "minLength": 1 },
        "longDescription": { "type": "string", "minLength": 1 },
        "developerName": { "type": "string", "minLength": 1 },
        "category": { "type": "string", "minLength": 1 },
        "capabilities": {
          "type": "array",
          "items": { "enum": ["Interactive", "Read", "Write"] }
        },
        "websiteURL": { "type": "string", "format": "uri" },
        "brandColor": { "type": "string", "pattern": "^#[0-9A-Fa-f]{6}$" },
        "composerIcon": { "type": "string", "pattern": "^\\./.+" },
        "logo": { "type": "string", "pattern": "^\\./.+" }
      }
    }
  },
  "properties": {
    "_generated": { "type": "string" },
    "name": { "type": "string", "minLength": 1 },
    "version": { "type": "string", "pattern": "^\\d+\\.\\d+\\.\\d+([-+].+)?$" },
    "description": { "type": "string", "minLength": 1 },
    "author": { "$ref": "#/$defs/author" },
    "homepage": { "type": "string", "format": "uri" },
    "repository": { "type": "string", "format": "uri" },
    "license": { "type": "string", "minLength": 1 },
    "keywords": { "type": "array", "items": { "type": "string" } },
    "skills": { "const": "./skills/" },
    "hooks": { "const": "./hooks/hooks-codex.json" },
    "interface": { "$ref": "#/$defs/interface" }
  }
}
