{
  "_generated": "GENERATED by scripts/generate.ts — edit marketplace.config.ts instead",
  "name": "devkit",
  "version": "0.3.0",
  "description": "Engineering-discipline skills for AI coding agents: pinned dev environments, test strategy, clean code, security, and navigable repos",
  "author": {
    "name": "Rahul Muttineni",
    "email": "rahulmutt@gmail.com"
  },
  "homepage": "https://github.com/rahulmutt/devkit",
  "repository": "https://github.com/rahulmutt/devkit",
  "license": "MIT",
  "keywords": [
    "skills",
    "mise",
    "devenv",
    "developer-environment",
    "testing",
    "clean-code",
    "security",
    "documentation"
  ],
  "skills": "./skills/",
  "hooks": "./hooks/hooks-codex.json",
  "interface": {
    "displayName": "Devkit",
    "shortDescription": "Engineering-discipline skills for AI coding agents: pinned dev environments, test strategy, clean code, security, and navigable repos",
    "longDescription": "Engineering-discipline skills for AI coding agents: pinned dev environments, test strategy, clean code, security, and navigable repos",
    "developerName": "Rahul Muttineni",
    "category": "Coding",
    "capabilities": [
      "Interactive",
      "Read",
      "Write"
    ],
    "websiteURL": "https://github.com/rahulmutt/devkit",
    "brandColor": "#2E7D5B",
    "composerIcon": "./assets/devkit.svg",
    "logo": "./assets/app-icon.png"
  }
}
